{
  "schema_version": 1,
  "id": "boba_fett",
  "display_name": "Боба Фетт",
  "description": "Легендарный галактический охотник за головами и наёмник, сын Джанго Фетт.",
  "ability": {
    "id": "bomb",
    "name": "Бомба",
    "text": "Создает бомбу которая двигается в задоном направление на заданное количество клеток от 1 до 3(одна клетка в твой хот) и взрывается когда попадает в корабль. От взрыва корабль получает 1 d4 урона",
    "kind": "active",
    "trigger": "manual_during_activation",
    "condition": [
      { "fact": "phase", "op": "eq", "value": "activation" },
      { "fact": "activation_seat_is_owner", "op": "eq", "value": true }
    ],
    "target_filter": {
      "target_kind": "board_cell",
      "min_distance": 1,
      "max_distance": 1,
      "destination": null,
      "count": 1
    },
    "cost": { "charges_mode": "fixed", "charges": 0, "consumes_ship_attack": false },
    "uses_per_match": 1,
    "effect_sequence": [
      {
        "op": "launch_bomb",
        "params": {
          "direction": "chosen_0_to_5",
          "initial_cell": "adjacent_in_direction",
          "cells_per_advance": 1,
          "advance_timing": "owner_activation_start",
          "max_cells": 3,
          "explode_on": "occupied_cell",
          "damage_dice": { "count": 1, "sides": 4 },
          "expire_behavior": "despawn"
        }
      }
    ],
    "priority": 20,
    "friendly_fire": true,
    "expires_at": "after_max_distance",
    "events": ["AbilityUsed", "BombPlaced", "BombAdvanced", "DamageApplied", "ShipDestroyed"],
    "test_plan": {
      "positive": "C019+ (план): бомба запускается в выбранном направлении 0–5 в свободную соседнюю клетку поля; в начале каждой активации владельца сдвигается ровно на 1 клетку по направлению (BombAdvanced); при входе в клетку с живым кораблём взрыв — 1d4 урона кораблю в клетке (щит → корпус); суммарный путь не превышает 3 клеток.",
      "negative": "C019− (план): запуск в занятую клетку или за край поля отклонен; продвижение более 1 клетки за одну активацию владельца и продвижение в чужие активации невозможны; после 3 пройденных клеток без попадания бомба снимается без урона (despawn); бомба не меняет направление; повторный запуск отклонён; {ok:false} без изменения состояния при отказах."
    },
    "design_notes": "Пины сверх исходного текста (все proposal_v3). (1) Запуск: бомба появляется в соседней с действующим кораблём владельца свободной клетке поля в выбранном направлении 0–5 (core-api §1); «заданное количество клеток от 1 до 3» трактуется как суммарный путь max_cells: 3. (2) Движение: ровно 1 клетка за активацию владельца («одна клетка в твой ход»), в момент ActivationStarted владельца; направление не меняется. (3) Срок: суммарно 3 клетки движения (expires_at: after_max_distance). (4) Взрыв: при входе бомбы в клетку с любым живым кораблём — свои и союзные не исключены текстом (friendly_fire: true); урон 1d4 сначала щиту, остаток корпусу. (5) Исчерпание пути без попадания: бомба снимается с доски без взрыва (expire_behavior: despawn) — текст описывает взрыв только «когда попадает в корабль»; вариант «взрыв на последней клетке» отклонён как усиление без опоры в тексте. (6) BombPlaced — proposal-событие: в списке событий MASTER_PLAN_RU §6.5 его нет; если не принять, создание бомбы покрывается AbilityUsed.",
    "proposal_v3": [
      "запуск: свободная соседняя клетка в выбранном направлении 0–5",
      "движение: 1 клетка в начале активации владельца, суммарный путь max 3 клетки",
      "истечение пути без попадания: despawn без урона",
      "событие BombPlaced — новое (proposal); иначе создание покрывает AbilityUsed"
    ]
  }
}
