{
  "schema_version": 1,
  "id": "anakin",
  "display_name": "Энакин Скайуокер",
  "description": "Был Энакином Скайуокер но когда стал ситхом и стал Дарт Вейдером.",
  "ability": {
    "id": "force_path",
    "name": "Путь силы",
    "text": "1 раза в игру может передвинуть любой корабль на расстоянии в одну клетку (не обязательно свой)",
    "kind": "active",
    "trigger": "manual_during_activation",
    "condition": [
      { "fact": "phase", "op": "eq", "value": "activation" },
      { "fact": "activation_seat_is_owner", "op": "eq", "value": true }
    ],
    "target_filter": {
      "target_kind": "any_ship",
      "min_distance": 1,
      "max_distance": 1,
      "destination": "adjacent_free_cell",
      "count": 1
    },
    "cost": { "charges_mode": "fixed", "charges": 0, "consumes_ship_attack": false },
    "uses_per_match": 1,
    "effect_sequence": [
      {
        "op": "move_ship",
        "params": { "destination": "adjacent_free_cell", "keep_facing": true }
      }
    ],
    "priority": 20,
    "friendly_fire": true,
    "expires_at": "immediate",
    "events": ["AbilityUsed", "ShipMoved"],
    "test_plan": {
      "positive": "C014+ (план): живой корабль-цель (свой, союзный или вражеский) на гекс-расстоянии 1 от действующего корабля владельца перемещается в свободную соседнюю с ним клетку в пределах поля; ориентация цели не меняется; использование списано.",
      "negative": "C014− (план): цель дальше 1 клетки отклонена; перемещение в занятую клетку или за край поля отклонено; попытка сменить ориентацию цели невозможна схемой; повторное использование и использование вне своей активации отклонены; {ok:false} без изменения состояния."
    },
    "design_notes": "Перемещается любой живой корабль — свой, союзный или вражеский (friendly_fire: true, дословно «не обязательно свой»). Открытые точки rules-v3 §9.6 пинятся так: расстояние 1 считается от действующего корабля владельца; назначение — свободная соседняя с ЦЕЛЬЮ клетка в пределах поля; ориентация цели не меняется (MASTER_PLAN_RU §4.9). Перемещение не тратит заряды цели и не считается её действием движения — оно не открывает цели активацию и не списывает её MoveForward.",
    "proposal_v3": [
      "точка отсчёта расстояния — действующий корабль владельца",
      "назначение — свободная соседняя клетка цели, без смены ориентации",
      "перемещение не расходует заряды цели и не считается её действием"
    ]
  }
}
