{
  "schema_version": 1,
  "id": "luke",
  "display_name": "Люк Скайуокер",
  "description": "Сын Дарта Вейдера и брат Леи Органа.",
  "ability": {
    "id": "precise_shot",
    "name": "Точный выстрел",
    "text": "1 раз в игру в свой ход может перевернуть кубик любой гранью (Но нельзя с 1 на 6)",
    "kind": "reaction",
    "trigger": "after_dice_revealed",
    "condition": [
      { "fact": "phase", "op": "eq", "value": "combat_reaction" },
      { "fact": "die_owner", "op": "eq", "value": "own" }
    ],
    "target_filter": null,
    "cost": { "charges_mode": "fixed", "charges": 0, "consumes_ship_attack": false },
    "uses_per_match": 1,
    "effect_sequence": [
      {
        "op": "set_die_face",
        "params": { "die_owner": "own", "forbid_from_face": 1, "forbid_to_face": 6 }
      }
    ],
    "priority": 10,
    "friendly_fire": false,
    "expires_at": "immediate",
    "events": ["AbilityUsed", "DieModified"],
    "test_plan": {
      "positive": "C016+ (план): корабль владельца в своём бою выбросил 2 — владелец переворачивает свой кубик на 5; итоговая сила пересчитывается до применения урона; использование списано.",
      "negative": "C016− (план): замена 1 на 6 отклонена; попытка перевернуть кубик противника отклонена; использование в чужом ходу/вне окна реакции отклонено; повторное использование отклонено; {ok:false} без изменения состояния."
    },
    "design_notes": "Открытый вопрос rules-v3 §9.6 решён по рекомендации MASTER_PLAN_RU §4.6: меняется грань исходного кубика, итоговая сила пересчитывается (слагаемое reactions формулы core-api §4.4). «В свой ход» = в бою, где корабль владельца атакует или защищается (любой свой бросок в своей активации). Запрещён только переход 1 → 6; прочие грани 1–6 разрешены, выбор за владельцем в окне реакции после открытия бросков.",
    "proposal_v3": [
      "меняется грань исходного кубика, а не итоговая сила",
      "«свой ход» — любой бросок (атака или защита) корабля владельца в его активации"
    ]
  }
}
