{
  "schema_version": 1,
  "id": "jango_fett",
  "display_name": "Джанго Фетт",
  "description": "Легендарный мандалорский воин, наёмник и лучший охотник за головами в галактике эпохи заката Галактической Республики.",
  "ability": {
    "id": "mine",
    "name": "Мина",
    "text": "Создает мину которая не двигается и взрывается когда корабль встает на туже клетку или на соседнии клетки что и мина. От взрыва получаешь 1d4 урона",
    "kind": "active",
    "trigger": "manual_during_activation",
    "condition": [
      { "fact": "phase", "op": "eq", "value": "activation" },
      { "fact": "activation_seat_is_owner", "op": "eq", "value": true }
    ],
    "target_filter": {
      "target_kind": "board_cell",
      "min_distance": 1,
      "max_distance": 2,
      "destination": null,
      "count": 1
    },
    "cost": { "charges_mode": "fixed", "charges": 0, "consumes_ship_attack": false },
    "uses_per_match": 1,
    "effect_sequence": [
      {
        "op": "place_mine",
        "params": {
          "placement": "free_cell",
          "placement_max_distance": 2,
          "trigger_radius": 1,
          "trigger_on": "ship_enter",
          "damage_dice": { "count": 1, "sides": 4 },
          "lifetime": "until_triggered_or_match_end",
          "removal": "on_trigger"
        }
      }
    ],
    "priority": 20,
    "friendly_fire": true,
    "expires_at": "match_end",
    "events": ["AbilityUsed", "MinePlaced", "MineTriggered", "DamageApplied", "ShipDestroyed"],
    "test_plan": {
      "positive": "C018+ (план): мина ставится на свободную клетку поля на гекс-расстоянии 1–2 от действующего корабля владельца; вражеский корабль, вступивший на клетку мины или её соседнюю клетку после установки, получает 1d4 урона (щит → корпус); мина снимается с доски (MinePlaced, затем MineTriggered + DamageApplied).",
      "negative": "C018− (план): установка на занятую клетку, за край или дальше 2 клеток отклонена; повторная установка отклонена; корабли, стоявшие в радиусе в момент установки, мину не взводят; союзный корабль, вошедший в радиус, получает урон (friendly_fire); урон не превышает 4; {ok:false} без изменения состояния при отказах."
    },
    "design_notes": "Пины сверх исходного текста (все proposal_v3). (1) Размещение: свободная клетка поля на гекс-расстоянии 1–2 от действующего корабля владельца; расстояние 0 невозможно (клетка занята самим кораблём). (2) Радиус срабатывания 1 — дословно из текста («та же клетка или соседние»). (3) Мина взводится событием ВХОДА корабля в радиус после установки: стоящие в радиусе на момент установки её не подрывают — иначе установка на расстоянии 1 была бы всегда невозможна. (4) Урон 1d4, сначала щиту, остаток корпусу (как в rules-v3 §7) — дословно. (5) Дружественный урон: текст не исключает свои/союзные корабли — мина бьёт любого вошедшего в радиус (friendly_fire: true). (6) Срок жизни: до срабатывания или до конца матча — в тексте срока нет, одна мина за матч не создаёт накопления; вариант «N раундов» отклонён как лишний параметр без опоры в тексте. (7) Подрывается первый вошедший в радиус корабль, после взрыва мина снимается (removal: on_trigger); одновременный вход двух кораблей в спринт-1 невозможен (за активацию двигается один корабль).",
    "proposal_v3": [
      "размещение: свободная клетка на гекс-расстоянии 1–2 от действующего корабля",
      "trigger_radius: 1; срабатывание по входу корабля в радиус после установки",
      "friendly_fire: true; урон 1d4 сначала щиту, остаток корпусу",
      "срок жизни: до срабатывания или конца матча (expires_at: match_end)"
    ]
  }
}
